{
    "schemaVersion":  "1.0.0",
    "sourceId":  "bili-bv1jjny6tehz",
    "title":  "【货币战争攻略】A850竟是有史以来最简单的一个版本？末法时代三体人诸神黄昏！货币战争癫疯之作 上场千冶刃想要多少分自己填",
    "author":  "甘泽成谣雨成诗",
    "url":  "https://www.bilibili.com/video/BV1jJNY6TEHz/",
    "publishedAt":  "2026-07-15T03:07:17Z",
    "accessedAt":  "2026-07-27T13:40:00Z",
    "applicableGameVersion":  "4.4",
    "copyrightStatus":  "linked_only",
    "locators":  [
                     "page:title",
                     "page:description 五条攻略路线",
                     "video:00:00-03:00 粗粒度版本判断复核窗口",
                     "video:03:00-07:00 粗粒度分支复核窗口",
                     "video:07:00-09:48 粗粒度收束复核窗口"
                 ]
}
