{
    "schemaVersion":  "1.0.0",
    "sourceId":  "bili-bv1unnq6aefk",
    "title":  "究极试用轮椅姬子正在摧毁货币战争!复制羁绊和装备?大领航时代降临！",
    "author":  "这看缘吧",
    "url":  "https://www.bilibili.com/video/BV1uNNq6AEFK/",
    "publishedAt":  "2026-07-15T09:43:59Z",
    "accessedAt":  "2026-07-27T13:40:00Z",
    "applicableGameVersion":  "4.4",
    "copyrightStatus":  "linked_only",
    "locators":  [
                     "page:title",
                     "page:description 三套攻略路线",
                     "video:00:00-01:30 粗粒度机制复核窗口",
                     "video:01:30-04:30 粗粒度分支复核窗口",
                     "video:04:30-06:22 粗粒度结算复核窗口"
                 ]
}
