{"schemaVersion":"1.0.0","sourceId":"synthetic-source-demo-001","title":"合成验证来源","author":"Phase 2 fixture","url":"https://example.invalid/synthetic-guide","publishedAt":"2026-07-27T00:00:00Z","accessedAt":"2026-07-27T00:00:00Z","applicableGameVersion":"4.4","copyrightStatus":"synthetic","locators":["paragraph:1"]}
